----------------------------------------------------------------------------
CrystalDiskInfo 8.17.11 (C) 2008-2022 hiyohiyo
                                Crystal Dew World: https://crystalmark.info/
----------------------------------------------------------------------------

    OS : Windows 10 Professional [10.0 Build 19045] (x64)
  Date : 2024/01/28 19:47:41

-- Controller Map ----------------------------------------------------------
 + Стандартный контроллер SATA AHCI [ATA]
   - WDC WD2005FBYZ-01YCBB2
   - ST1000DM003-1CH162
 - Контроллер дискового пространства (Майкрософт) [SCSI]
 + Стандартный контроллер NVM Express [SCSI]
   - MSI M390 250GB
 - Контроллер замыкания виртуального жесткого диска на себя (Майкрософт) [SCSI]

-- Disk List ---------------------------------------------------------------
 (01) WDC WD2005FBYZ-01YCBB2 : 2000,3 GB [0/0/0, pd1]
 (02) ST1000DM003-1CH162 : 1000,2 GB [1/0/0, pd1]
 (03) MSI M390 250GB : 250,0 GB [2/1/0, sq] - nv

----------------------------------------------------------------------------
 (01) WDC WD2005FBYZ-01YCBB2
----------------------------------------------------------------------------
           Model : WDC WD2005FBYZ-01YCBB2
        Firmware : RR07
   Serial Number : ***************
       Disk Size : 2000,3 GB (8,4/137,4/2000,3/2000,3)
     Buffer Size : Неизвестно
     Queue Depth : 32
    # of Sectors : 3907029168
   Rotation Rate : 7200 RPM
       Interface : Serial ATA
   Major Version : ACS-3
   Minor Version : ACS-3 Revision 5
   Transfer Mode : SATA/600 | SATA/600
  Power On Hours : 12869 ч
  Power On Count : 113 раз
     Temperature : 35 C (95 F)
   Health Status : Хорошо
        Features : S.M.A.R.T., APM, NCQ, GPL
       APM Level : 0060h [ON]
       AAM Level : ----
    Drive Letter : D:

-- S.M.A.R.T. --------------------------------------------------------------
ID Cur Wor Thr RawValues(6) Attribute Name
01 200 200 _51 000000000000 Частота ошибок чтения
03 197 181 _21 000000000C3D Время раскрутки
04 100 100 __0 000000000234 Запуски/остановки шпинделя
05 200 200 140 000000000000 Переназначенные сектора
07 100 200 __0 000000000000 Частота ошибок позиционирования
09 _83 _83 __0 000000003245 Часы работы
0A 100 100 __0 000000000000 Повторные попытки раскрутки
0B 100 100 __0 000000000000 Повторы рекалибровки
0C 100 100 __0 000000000071 Включения/отключения
10 __1 199 __0 001341B36418 Спецификации производителя
B7 100 100 __0 000000000000 Спецификации производителя
C0 200 200 __0 000000000039 Аварийные парковки при отключении питания
C1 198 198 __0 00000000186F Полных циклов парковок головок
C2 112 _98 __0 000000000023 Температура
C4 200 200 __0 000000000000 События переназначения
C5 200 200 __0 000000000000 Нестабильные сектора
C6 100 253 __0 000000000000 Неисправимые ошибки секторов
C7 200 200 __0 000000000000 CRC-ошибки UltraDMA
C8 100 253 __0 000000000000 Частота ошибок записи

-- IDENTIFY_DEVICE ---------------------------------------------------------
        0    1    2    3    4    5    6    7    8    9
000: 427A 3FFF C837 0010 0000 0000 003F 0000 0000 0000
010: FFFF FFFF FFFF FFFF FFFF FFFF FFFF FFFF FFFF FFFF
020: 0000 0000 0000 5252 3037 2020 2020 5744 4320 5744
030: 3230 3035 4642 595A 2D30 3159 4342 4232 2020 2020
040: 2020 2020 2020 2020 2020 2020 2020 8010 4000 2F00
050: 4001 0000 0000 0007 3FFF 0010 003F FC10 00FB 5D10
060: FFFF 0FFF 0000 0007 0003 0078 0078 0078 0078 2108
070: 0000 0000 0000 0000 0000 001F DD0E 0046 00CC 0040
080: 07FE 006D 706B 7469 6163 7069 B449 6163 017F 0075
090: 0075 0060 FFFE 0000 0000 0000 0000 0000 0000 0000
100: 88B0 E8E0 0000 0000 0000 0000 4000 0000 5001 4EE0
110: 0480 D164 0000 0000 0000 0000 0000 0000 0000 43DC
120: 401C 0000 0000 0000 0000 0000 0000 0000 0029 0000
130: 0000 0000 0000 16FE 023F 08B2 0000 0000 0000 0000
140: 0000 0000 0005 0000 5744 4320 4D4F 4445 4C2D 5341
150: 5441 2043 492D 4620 4449 534B 2D55 5352 0000 0000
160: 0000 0000 0000 0000 0000 0000 0000 0000 0002 0000
170: 0000 0000 0000 0000 0000 0000 0000 0000 0000 0000
180: 0000 0000 0000 0000 0000 0000 0000 0000 0000 0000
190: 0000 0000 0000 0000 0000 0000 0000 0000 0000 0000
200: 0000 0000 0000 0000 0000 0000 203D 0000 0000 4000
210: 0000 0000 0000 0000 0000 0000 0000 1C20 0000 0000
220: 0000 0000 107E 0000 0000 0000 0000 0000 0000 0000
230: 88B0 E8E0 0000 0000 0001 1000 0000 0000 0000 0000
240: 0000 0000 0000 0000 0000 0000 0000 0000 0000 0000
250: 0000 0000 0000 0000 0000 39A5

-- SMART_READ_DATA ---------------------------------------------------------
     +0 +1 +2 +3 +4 +5 +6 +7 +8 +9 +A +B +C +D +E +F
000: 10 00 01 2F 00 C8 C8 00 00 00 00 00 00 00 03 27
010: 00 C5 B5 3D 0C 00 00 00 00 00 04 32 00 64 64 34
020: 02 00 00 00 00 00 05 33 00 C8 C8 00 00 00 00 00
030: 00 00 07 2E 00 64 C8 00 00 00 00 00 00 00 09 32
040: 00 53 53 45 32 00 00 00 00 00 0A 32 00 64 64 00
050: 00 00 00 00 00 00 0B 32 00 64 64 00 00 00 00 00
060: 00 00 0C 32 00 64 64 71 00 00 00 00 00 00 10 22
070: 00 01 C7 18 64 B3 41 13 00 00 B7 32 00 64 64 00
080: 00 00 00 00 00 00 C0 32 00 C8 C8 39 00 00 00 00
090: 00 00 C1 32 00 C6 C6 6F 18 00 00 00 00 00 C2 22
0A0: 00 70 62 23 00 00 00 00 00 00 C4 32 00 C8 C8 00
0B0: 00 00 00 00 00 00 C5 32 00 C8 C8 00 00 00 00 00
0C0: 00 00 C6 30 00 64 FD 00 00 00 00 00 00 00 C7 32
0D0: 00 C8 C8 00 00 00 00 00 00 00 C8 08 00 64 FD 00
0E0: 00 00 00 00 00 00 00 00 00 00 00 00 00 00 00 00
0F0: 00 00 00 00 00 00 00 00 00 00 00 00 00 00 00 00
100: 00 00 00 00 00 00 00 00 00 00 00 00 00 00 00 00
110: 00 00 00 00 00 00 00 00 00 00 00 00 00 00 00 00
120: 00 00 00 00 00 00 00 00 00 00 00 00 00 00 00 00
130: 00 00 00 00 00 00 00 00 00 00 00 00 00 00 00 00
140: 00 00 00 00 00 00 00 00 00 00 00 00 00 00 00 00
150: 00 00 00 00 00 00 00 00 00 00 00 00 00 00 00 00
160: 00 00 00 00 00 00 00 00 00 00 00 00 00 00 00 7B
170: 03 00 01 00 02 D0 05 00 00 00 00 00 00 00 00 00
180: 00 00 01 04 00 00 00 00 00 00 00 00 00 00 00 00
190: 00 00 00 00 00 00 00 00 00 00 00 00 00 00 00 00
1A0: 00 00 00 00 00 00 00 00 00 00 00 00 00 00 00 00
1B0: 00 00 00 00 00 00 00 00 0F 00 00 00 00 00 00 00
1C0: 00 00 00 00 00 00 00 00 00 00 00 00 00 00 00 00
1D0: 00 00 00 00 00 00 00 00 00 00 00 00 00 00 00 00
1E0: 00 00 00 00 00 00 00 00 00 00 00 00 00 00 00 00
1F0: 00 00 00 00 00 00 00 00 00 00 00 00 00 00 00 BE

-- SMART_READ_THRESHOLD ----------------------------------------------------
     +0 +1 +2 +3 +4 +5 +6 +7 +8 +9 +A +B +C +D +E +F
000: 10 00 01 33 C8 C8 C8 C8 00 00 00 00 00 00 03 15
010: 00 00 00 00 00 00 00 00 00 00 04 00 00 00 00 00
020: 00 00 00 00 00 00 05 8C 00 00 00 00 00 00 00 00
030: 00 00 07 00 64 64 64 64 00 00 00 00 00 00 09 00
040: 00 00 00 00 00 00 00 00 00 00 0A 00 00 00 00 00
050: 00 00 00 00 00 00 0B 00 00 00 00 00 00 00 00 00
060: 00 00 0C 00 00 00 00 00 00 00 00 00 00 00 10 00
070: 00 00 00 00 00 00 00 00 00 00 B7 00 00 00 00 00
080: 00 00 00 00 00 00 C0 00 00 00 00 00 00 00 00 00
090: 00 00 C1 00 00 00 00 00 00 00 00 00 00 00 C2 00
0A0: 00 00 00 00 00 00 00 00 00 00 C4 00 00 00 00 00
0B0: 00 00 00 00 00 00 C5 00 00 00 00 00 00 00 00 00
0C0: 00 00 C6 00 00 00 00 00 00 00 00 00 00 00 C7 00
0D0: 00 00 00 00 00 00 00 00 00 00 C8 00 C8 C8 C8 C8
0E0: 00 00 00 00 00 00 00 00 00 00 00 00 00 00 00 00
0F0: 00 00 00 00 00 00 00 00 00 00 00 00 00 00 00 00
100: 00 00 00 00 00 00 00 00 00 00 00 00 00 00 00 00
110: 00 00 00 00 00 00 00 00 00 00 00 00 00 00 00 00
120: 00 00 00 00 00 00 00 00 00 00 00 00 00 00 00 00
130: 00 00 00 00 00 00 00 00 00 00 00 00 00 00 00 00
140: 00 00 00 00 00 00 00 00 00 00 00 00 00 00 00 00
150: 00 00 00 00 00 00 00 00 00 00 00 00 00 00 00 00
160: 00 00 00 00 00 00 00 00 00 00 00 00 00 00 00 00
170: 00 00 00 00 00 00 00 00 00 00 00 00 00 00 00 00
180: 00 00 00 00 00 00 00 00 00 00 00 00 00 00 00 00
190: 00 00 00 00 00 00 00 00 00 00 00 00 00 00 00 00
1A0: 00 00 00 00 00 00 00 00 00 00 00 00 00 00 00 00
1B0: 00 00 00 00 00 00 00 00 00 00 00 00 00 00 00 00
1C0: 00 00 00 00 00 00 00 00 00 00 00 00 00 00 00 00
1D0: 00 00 00 00 00 00 00 00 00 00 00 00 00 00 00 00
1E0: 00 00 00 00 00 00 00 00 00 00 00 00 00 00 00 00
1F0: 00 00 00 00 00 00 00 00 00 00 00 00 00 00 00 26

----------------------------------------------------------------------------
 (02) ST1000DM003-1CH162
----------------------------------------------------------------------------
           Model : ST1000DM003-1CH162
        Firmware : CC47
   Serial Number : ********
       Disk Size : 1000,2 GB (8,4/137,4/1000,2/1000,2)
     Buffer Size : Неизвестно
     Queue Depth : 32
    # of Sectors : 1953525168
   Rotation Rate : 7200 RPM
       Interface : Serial ATA
   Major Version : ACS-2
   Minor Version : ACS-3 Revision 3b
   Transfer Mode : SATA/600 | SATA/600
  Power On Hours : 31484 ч
  Power On Count : 44 раз
     Temperature : 35 C (95 F)
   Health Status : Хорошо
        Features : S.M.A.R.T., APM, NCQ, GPL
       APM Level : 8080h [ON]
       AAM Level : ----
    Drive Letter : E:

-- S.M.A.R.T. --------------------------------------------------------------
ID Cur Wor Thr RawValues(6) Attribute Name
01 117 _99 __6 00000702B260 Частота ошибок чтения
03 _98 _97 __0 000000000000 Время раскрутки
04 100 100 _20 000000000037 Запуски/остановки шпинделя
05 100 100 _10 000000000000 Переназначенные сектора
07 _87 _60 _30 00001CEC0B96 Частота ошибок позиционирования
09 _65 _65 __0 000000007AFC Часы работы
0A 100 100 _97 000000000000 Повторные попытки раскрутки
0C 100 100 _20 00000000002C Включения/отключения
B7 100 100 __0 000000000000 Спецификации производителя
B8 100 100 _99 000000000000 Ошибки End-to-End
BB 100 100 __0 000000000000 Неисправимые ошибки
BC 100 100 __0 000000000000 Таймаут команды
BD _99 _99 __0 000000000001 Высокоуровневая запись
BE _65 _58 _45 000028180023 Температура воздушного потока
BF 100 100 __0 000000000000 Частота ошибок при ударных нагрузках
C0 100 100 __0 000000000024 Аварийные парковки при отключении питания
C1 _78 _78 __0 00000000ACA3 Полных циклов парковок головок
C2 _35 _42 __0 001100000023 Температура
C5 100 100 __0 000000000000 Нестабильные сектора
C6 100 100 __0 000000000000 Неисправимые ошибки секторов
C7 200 200 __0 000000000000 CRC-ошибки UltraDMA
F0 100 253 __0 E27300007A91 Время позиционирования головок (часы)
F1 100 253 __0 00045C0400FA Всего хост-записей
F2 100 253 __0 000825C51C69 Всего хост-чтений

-- IDENTIFY_DEVICE ---------------------------------------------------------
        0    1    2    3    4    5    6    7    8    9
000: 0C5A 3FFF C837 0010 0000 0000 003F 0000 0000 0000
010: FFFF FFFF FFFF FFFF FFFF FFFF FFFF FFFF FFFF FFFF
020: 0000 0000 0004 4343 3437 2020 2020 5354 3130 3030
030: 444D 3030 332D 3143 4831 3632 2020 2020 2020 2020
040: 2020 2020 2020 2020 2020 2020 2020 8010 4000 2F00
050: 4000 0200 0200 0007 3FFF 0010 003F FC10 00FB 0110
060: FFFF 0FFF 0000 0007 0003 0078 0078 0078 0078 0000
070: 0000 0000 0000 0000 0000 001F 850E 0006 004C 0040
080: 03F0 001F 346B 7D69 4163 3469 BC49 4163 017F 0034
090: 0034 8080 FFFE 0000 D000 0000 0000 0000 0000 0000
100: 6DB0 7470 0000 0000 0000 0000 6003 0000 5000 C500
110: 7929 5752 0000 0000 0000 0000 0000 0000 0000 401E
120: 401C 0000 0000 0000 0000 0000 0000 0000 0029 6DB0
130: 7470 6DB0 7470 2020 0002 0140 0100 5000 3C06 3C0A
140: 0000 003C 0000 0008 0000 0000 05FF 0280 0000 0000
150: 0008 0000 0000 0000 0000 0000 0000 0000 5800 8800
160: 0000 0000 0000 0000 0000 0000 0000 0000 0002 0000
170: 0000 0000 0000 0000 0000 0000 0000 0000 0000 0000
180: 0000 0000 0000 0000 0000 0000 0000 0000 0000 0000
190: 0000 0000 0000 0000 0000 0000 0000 0000 0000 0000
200: 0000 0000 0000 0000 0000 0000 3085 0000 0000 4000
210: 0000 0000 0000 0000 0000 0000 0000 1C20 0000 0000
220: 0000 0000 107E 0000 0000 0000 0000 0000 0000 0000
230: 0000 0000 0000 0000 0000 0000 0000 0000 0000 0000
240: 0000 0000 0000 0003 0000 0000 0000 0000 0000 0000
250: 0000 0000 0000 0000 0000 BBA5

-- SMART_READ_DATA ---------------------------------------------------------
     +0 +1 +2 +3 +4 +5 +6 +7 +8 +9 +A +B +C +D +E +F
000: 0A 00 01 0F 00 75 63 60 B2 02 07 00 00 00 03 03
010: 00 62 61 00 00 00 00 00 00 00 04 32 00 64 64 37
020: 00 00 00 00 00 00 05 33 00 64 64 00 00 00 00 00
030: 00 00 07 0F 00 57 3C 96 0B EC 1C 00 00 00 09 32
040: 00 41 41 FC 7A 00 00 00 00 00 0A 13 00 64 64 00
050: 00 00 00 00 00 00 0C 32 00 64 64 2C 00 00 00 00
060: 00 00 B7 32 00 64 64 00 00 00 00 00 00 00 B8 32
070: 00 64 64 00 00 00 00 00 00 00 BB 32 00 64 64 00
080: 00 00 00 00 00 00 BC 32 00 64 64 00 00 00 00 00
090: 00 00 BD 3A 00 63 63 01 00 00 00 00 00 00 BE 22
0A0: 00 41 3A 23 00 18 28 00 00 00 BF 32 00 64 64 00
0B0: 00 00 00 00 00 00 C0 32 00 64 64 24 00 00 00 00
0C0: 00 00 C1 32 00 4E 4E A3 AC 00 00 00 00 00 C2 22
0D0: 00 23 2A 23 00 00 00 11 00 00 C5 12 00 64 64 00
0E0: 00 00 00 00 00 00 C6 10 00 64 64 00 00 00 00 00
0F0: 00 00 C7 3E 00 C8 C8 00 00 00 00 00 00 00 F0 00
100: 00 64 FD 91 7A 00 00 73 E2 01 F1 00 00 64 FD FA
110: 00 04 5C 04 00 00 F2 00 00 64 FD 69 1C C5 25 08
120: 00 00 00 00 00 00 00 00 00 00 00 00 00 00 00 00
130: 00 00 00 00 00 00 00 00 00 00 00 00 00 00 00 00
140: 00 00 00 00 00 00 00 00 00 00 00 00 00 00 00 00
150: 00 00 00 00 00 00 00 00 00 00 00 00 00 00 00 00
160: 00 00 00 00 00 00 00 00 00 00 00 00 3F 02 00 73
170: 03 00 01 00 01 6D 02 00 00 00 00 00 00 00 00 00
180: 00 00 00 00 D8 1C 00 00 07 03 01 03 01 03 01 03
190: 01 00 00 00 00 00 00 00 00 01 00 00 00 00 00 00
1A0: 00 00 00 00 00 00 00 00 DC 9D 33 6F 16 67 00 00
1B0: 00 00 00 00 01 00 FB 1B FA 00 04 5C 04 00 00 00
1C0: 69 1C C5 25 08 00 00 00 00 00 00 00 00 00 00 00
1D0: 00 00 00 00 00 00 00 00 F2 1A 00 00 01 00 00 00
1E0: 00 00 00 00 E0 02 02 00 00 00 00 00 00 00 00 01
1F0: 00 00 00 00 00 00 00 00 00 00 00 00 00 00 00 8D

-- SMART_READ_THRESHOLD ----------------------------------------------------
     +0 +1 +2 +3 +4 +5 +6 +7 +8 +9 +A +B +C +D +E +F
000: 01 00 01 06 00 00 00 00 00 00 00 00 00 00 03 00
010: 00 00 00 00 00 00 00 00 00 00 04 14 00 00 00 00
020: 00 00 00 00 00 00 05 0A 00 00 00 00 00 00 00 00
030: 00 00 07 1E 00 00 00 00 00 00 00 00 00 00 09 00
040: 00 00 00 00 00 00 00 00 00 00 0A 61 00 00 00 00
050: 00 00 00 00 00 00 0C 14 00 00 00 00 00 00 00 00
060: 00 00 B7 00 00 00 00 00 00 00 00 00 00 00 B8 63
070: 00 00 00 00 00 00 00 00 00 00 BB 00 00 00 00 00
080: 00 00 00 00 00 00 BC 00 00 00 00 00 00 00 00 00
090: 00 00 BD 00 00 00 00 00 00 00 00 00 00 00 BE 2D
0A0: 00 00 00 00 00 00 00 00 00 00 BF 00 00 00 00 00
0B0: 00 00 00 00 00 00 C0 00 00 00 00 00 00 00 00 00
0C0: 00 00 C1 00 00 00 00 00 00 00 00 00 00 00 C2 00
0D0: 00 00 00 00 00 00 00 00 00 00 C5 00 00 00 00 00
0E0: 00 00 00 00 00 00 C6 00 00 00 00 00 00 00 00 00
0F0: 00 00 C7 00 00 00 00 00 00 00 00 00 00 00 F0 00
100: 00 00 00 00 00 00 00 00 00 00 F1 00 00 00 00 00
110: 00 00 00 00 00 00 F2 00 00 00 00 00 00 00 00 00
120: 00 00 00 00 00 00 00 00 00 00 00 00 00 00 00 00
130: 00 00 00 00 00 00 00 00 00 00 00 00 00 00 00 00
140: 00 00 00 00 00 00 00 00 00 00 00 00 00 00 00 00
150: 00 00 00 00 00 00 00 00 00 00 00 00 00 00 00 00
160: 00 00 00 00 00 00 00 00 00 00 00 00 00 00 00 00
170: 00 00 00 00 00 00 00 00 00 00 00 00 00 00 00 00
180: 00 00 00 00 00 00 00 00 00 00 00 00 00 00 00 00
190: 00 00 00 00 00 00 00 00 00 00 00 00 00 00 00 00
1A0: 00 00 00 00 00 00 00 00 00 00 00 00 00 00 00 00
1B0: 00 00 00 00 00 00 00 00 00 00 00 00 00 00 00 00
1C0: 00 00 00 00 00 00 00 00 00 00 00 00 00 00 00 00
1D0: 00 00 00 00 00 00 00 00 00 00 00 00 00 00 00 00
1E0: 00 00 00 00 00 00 00 00 00 00 00 00 00 00 00 00
1F0: 00 00 00 00 00 00 00 00 00 00 00 00 00 00 00 FD

----------------------------------------------------------------------------
 (03) MSI M390 250GB
----------------------------------------------------------------------------
           Model : MSI M390 250GB
        Firmware : EHFM32.1
   Serial Number : ******************
       Disk Size : 250,0 GB
       Interface : NVM Express
        Standard : NVM Express 1.4
   Transfer Mode : PCIe 3.0 x4 | PCIe 3.0 x4
  Power On Hours : 8312 ч
  Power On Count : 92 раз
      Host Reads : 5669 GB
     Host Writes : 31706 GB
     Temperature : 40 C (104 F)
   Health Status : Хорошо (64 %)
        Features : S.M.A.R.T., TRIM, VolatileWriteCache
    Drive Letter : C:

-- S.M.A.R.T. --------------------------------------------------------------
ID RawValues(6) Attribute Name
01 000000000000 Критическое предупреждение
02 000000000139 Составная температура
03 000000000064 Доступный запас
04 000000000005 Порог доступного запаса
05 000000000024 Процент использования
06 000000B5709F Единицы данных - чтение
07 000003F697D7 Единицы данных - запись
08 00000880A9CE Команды хост-чтения
09 00001E475F25 Команды хост-записи
0A 00000000047C Время работы контроллера
0B 00000000005C Включения/отключения
0C 000000002078 Часы работы
0D 000000000024 Небезопасные отключения
0E 000000000000 Ошибки целостности носителя и данных
0F 000000000004 Записи в журнале информации об ошибках

-- IDENTIFY_DEVICE ---------------------------------------------------------
        0    1    2    3    4    5    6    7    8    9
000: 1987 1987 FFFF FFFF FFFF FFFF FFFF FFFF FFFF FFFF
010: FFFF FFFF 534D 2049 334D 3039 3220 3035 4247 2020
020: 2020 2020 2020 2020 2020 2020 2020 2020 2020 2020
030: 2020 2020 4845 4D46 3233 312E A704 6479 0600 0000
040: 0400 0001 A120 0007 4B40 004C 0200 0000 0002 0000
050: 0000 0000 0000 0000 0000 0100 0000 0000 0000 0000
060: 0000 0000 0000 0000 0000 0000 0000 0000 0000 0000
070: 0000 0000 0000 0000 0000 0000 0000 0000 0000 0000
080: 0000 0000 0000 0000 0000 0000 0000 0000 0000 0000
090: 0000 0000 0000 0000 0000 0000 0000 0000 0000 0000
100: 0000 0000 0000 0000 0000 0000 0000 0000 0000 0000
110: 0000 0000 0000 0000 0000 0000 0000 0000 0000 0000
120: 0000 0000 0000 0000 0000 0000 0000 0000 0017 0303
130: 1E12 043E 0101 0165 0169 0064 4000 0000 4000 0000
140: 0000 0000 0000 0000 0000 0000 0000 0000 0000 0000
150: 0000 0000 0000 0000 0000 0000 0000 0000 001E 0400
160: 0000 0001 0111 0164 0002 A000 0400 0000 0010 0000
170: 0001 0000 0000 0000 0000 0000 0060 0000 0000 0000
180: 0000 0000 0000 0000 0000 0000 0000 0000 0000 0000
190: 0000 0000 0000 0000 0000 0000 0000 0000 0000 0000
200: 0000 0000 0000 0000 0000 0000 0000 0000 0000 0000
210: 0000 0000 0000 0000 0000 0000 0000 0000 0000 0000
220: 0000 0000 0000 0000 0000 0000 0000 0000 0000 0000
230: 0000 0000 0000 0000 0000 0000 0000 0000 0000 0000
240: 0000 0000 0000 0000 0000 0000 0000 0000 0000 0000
250: 0000 0000 0000 0000 0000 0000

-- SMART_NVME --------------------------------------------------------------
     +0 +1 +2 +3 +4 +5 +6 +7 +8 +9 +A +B +C +D +E +F
000: 00 39 01 64 05 24 00 00 00 00 00 00 00 00 00 00
010: 00 00 00 00 00 00 00 00 00 00 00 00 00 00 00 00
020: 9F 70 B5 00 00 00 00 00 00 00 00 00 00 00 00 00
030: D7 97 F6 03 00 00 00 00 00 00 00 00 00 00 00 00
040: CE A9 80 08 00 00 00 00 00 00 00 00 00 00 00 00
050: 25 5F 47 1E 00 00 00 00 00 00 00 00 00 00 00 00
060: 7C 04 00 00 00 00 00 00 00 00 00 00 00 00 00 00
070: 5C 00 00 00 00 00 00 00 00 00 00 00 00 00 00 00
080: 78 20 00 00 00 00 00 00 00 00 00 00 00 00 00 00
090: 24 00 00 00 00 00 00 00 00 00 00 00 00 00 00 00
0A0: 00 00 00 00 00 00 00 00 00 00 00 00 00 00 00 00
0B0: 04 00 00 00 00 00 00 00 00 00 00 00 00 00 00 00
0C0: 00 00 00 00 00 00 00 00 00 00 00 00 00 00 00 00
0D0: 00 00 00 00 00 00 00 00 00 00 00 00 00 00 00 00
0E0: 00 00 00 00 00 00 00 00 00 00 00 00 00 00 00 00
0F0: 00 00 00 00 00 00 00 00 00 00 00 00 00 00 00 00
100: 00 00 00 00 00 00 00 00 00 00 00 00 00 00 00 00
110: 00 00 00 00 00 00 00 00 00 00 00 00 00 00 00 00
120: 00 00 00 00 00 00 00 00 00 00 00 00 00 00 00 00
130: 00 00 00 00 00 00 00 00 00 00 00 00 00 00 00 00
140: 00 00 00 00 00 00 00 00 00 00 00 00 00 00 00 00
150: 00 00 00 00 00 00 00 00 00 00 00 00 00 00 00 00
160: 00 00 00 00 00 00 00 00 00 00 00 00 00 00 00 00
170: 00 00 00 00 00 00 00 00 00 00 00 00 00 00 00 00
180: 00 00 00 00 00 00 00 00 00 00 00 00 00 00 00 00
190: 00 00 00 00 00 00 00 00 00 00 00 00 00 00 00 00
1A0: 00 00 00 00 00 00 00 00 00 00 00 00 00 00 00 00
1B0: 00 00 00 00 00 00 00 00 00 00 00 00 00 00 00 00
1C0: 00 00 00 00 00 00 00 00 00 00 00 00 00 00 00 00
1D0: 00 00 00 00 00 00 00 00 00 00 00 00 00 00 00 00
1E0: 00 00 00 00 00 00 00 00 00 00 00 00 00 00 00 00
1F0: 00 00 00 00 00 00 00 00 00 00 00 00 00 00 00 00

